<?xml version="1.0" encoding="UTF-8"?>
<!-- edited with XMLSpy v2021 rel. 3 (x64) (http://www.altova.com) by Tulli (Tulli) -->
<xs:schema xmlns:xs="http://www.w3.org/2001/XMLSchema" xmlns:vc="http://www.w3.org/2007/XMLSchema-versioning" elementFormDefault="qualified" attributeFormDefault="unqualified" vc:minVersion="1.1">
	<xs:element name="Message" type="MessageType"/>
	<xs:element name="DataGroup" type="DataGroupType"/>
	<xs:element name="DataElement" type="DataElementType"/>
	<xs:complexType name="DataGroupType">
		<xs:sequence>
			<xs:element name="Name" maxOccurs="3">
				<xs:complexType>
					<xs:simpleContent>
						<xs:extension base="NameType">
							<xs:attribute name="lang" use="required">
								<xs:simpleType>
									<xs:restriction base="xs:string">
										<xs:maxLength value="2"/>
										<xs:pattern value="fi|sv|en"/>
									</xs:restriction>
								</xs:simpleType>
							</xs:attribute>
						</xs:extension>
					</xs:simpleContent>
				</xs:complexType>
			</xs:element>
			<xs:element name="Alias" minOccurs="0" maxOccurs="3">
				<xs:complexType>
					<xs:simpleContent>
						<xs:extension base="NameType">
							<xs:attribute name="lang" use="required">
								<xs:simpleType>
									<xs:restriction base="xs:string">
										<xs:maxLength value="2"/>
										<xs:pattern value="fi|sv|en"/>
									</xs:restriction>
								</xs:simpleType>
							</xs:attribute>
						</xs:extension>
					</xs:simpleContent>
				</xs:complexType>
			</xs:element>
			<xs:element name="Use" minOccurs="0" maxOccurs="99">
				<xs:simpleType>
					<xs:restriction base="xs:string">
						<xs:maxLength value="6"/>
					</xs:restriction>
				</xs:simpleType>
			</xs:element>
			<xs:element name="Filter" minOccurs="0" maxOccurs="99">
				<xs:simpleType>
					<xs:restriction base="xs:string">
						<xs:maxLength value="10"/>
					</xs:restriction>
				</xs:simpleType>
			</xs:element>
			<xs:element name="XPath">
				<xs:simpleType>
					<xs:restriction base="XPathType"/>
				</xs:simpleType>
			</xs:element>
			<xs:element name="Group" type="XPathType"/>
			<xs:element name="MinOccurence" maxOccurs="99">
				<xs:complexType>
					<xs:simpleContent>
						<xs:extension base="xs:integer">
							<xs:attribute name="use">
								<xs:simpleType>
									<xs:restriction base="xs:string">
										<xs:maxLength value="6"/>
									</xs:restriction>
								</xs:simpleType>
							</xs:attribute>
						</xs:extension>
					</xs:simpleContent>
				</xs:complexType>
			</xs:element>
			<xs:element name="MaxOccurence" maxOccurs="99">
				<xs:complexType>
					<xs:simpleContent>
						<xs:extension base="xs:integer">
							<xs:attribute name="use">
								<xs:simpleType>
									<xs:restriction base="xs:string">
										<xs:maxLength value="6"/>
									</xs:restriction>
								</xs:simpleType>
							</xs:attribute>
						</xs:extension>
					</xs:simpleContent>
				</xs:complexType>
			</xs:element>
			<xs:element name="Rule" minOccurs="0" maxOccurs="unbounded">
				<xs:complexType>
					<xs:simpleContent>
						<xs:extension base="ConstraintsType">
							<xs:attribute name="use">
								<xs:simpleType>
									<xs:restriction base="xs:string">
										<xs:maxLength value="6"/>
									</xs:restriction>
								</xs:simpleType>
							</xs:attribute>
						</xs:extension>
					</xs:simpleContent>
				</xs:complexType>
			</xs:element>
			<xs:element name="Condition" minOccurs="0" maxOccurs="unbounded">
				<xs:complexType>
					<xs:simpleContent>
						<xs:extension base="ConstraintsType">
							<xs:attribute name="use">
								<xs:simpleType>
									<xs:restriction base="xs:string">
										<xs:maxLength value="6"/>
									</xs:restriction>
								</xs:simpleType>
							</xs:attribute>
						</xs:extension>
					</xs:simpleContent>
				</xs:complexType>
			</xs:element>
			<xs:element name="DescriptionLine" minOccurs="0" maxOccurs="unbounded">
				<xs:complexType>
					<xs:simpleContent>
						<xs:extension base="DescriptionLineType">
							<xs:attribute name="lang" use="required">
								<xs:simpleType>
									<xs:restriction base="xs:string">
										<xs:maxLength value="2"/>
										<xs:pattern value="fi|sv|en"/>
									</xs:restriction>
								</xs:simpleType>
							</xs:attribute>
							<xs:attribute name="use">
								<xs:simpleType>
									<xs:restriction base="xs:string">
										<xs:maxLength value="6"/>
									</xs:restriction>
								</xs:simpleType>
							</xs:attribute>
						</xs:extension>
					</xs:simpleContent>
				</xs:complexType>
			</xs:element>
			<xs:choice maxOccurs="unbounded">
				<xs:element ref="DataElement"/>
				<xs:element ref="DataGroup" minOccurs="0"/>
			</xs:choice>
		</xs:sequence>
		<xs:attribute name="hidden">
			<xs:simpleType>
				<xs:restriction base="xs:string">
					<xs:maxLength value="4"/>
					<xs:pattern value="true"/>
				</xs:restriction>
			</xs:simpleType>
		</xs:attribute>
	</xs:complexType>
	<xs:complexType name="DataElementType">
		<xs:sequence>
			<xs:element name="Name" maxOccurs="3">
				<xs:complexType>
					<xs:simpleContent>
						<xs:extension base="NameType">
							<xs:attribute name="lang" use="required">
								<xs:simpleType>
									<xs:restriction base="xs:string">
										<xs:maxLength value="2"/>
										<xs:pattern value="fi|sv|en"/>
									</xs:restriction>
								</xs:simpleType>
							</xs:attribute>
						</xs:extension>
					</xs:simpleContent>
				</xs:complexType>
			</xs:element>
			<xs:element name="Alias" minOccurs="0" maxOccurs="3">
				<xs:complexType>
					<xs:simpleContent>
						<xs:extension base="NameType">
							<xs:attribute name="lang" use="required">
								<xs:simpleType>
									<xs:restriction base="xs:string">
										<xs:maxLength value="2"/>
										<xs:pattern value="fi|sv|en"/>
									</xs:restriction>
								</xs:simpleType>
							</xs:attribute>
						</xs:extension>
					</xs:simpleContent>
				</xs:complexType>
			</xs:element>
			<xs:element name="Use" minOccurs="0" maxOccurs="99">
				<xs:simpleType>
					<xs:restriction base="xs:string">
						<xs:maxLength value="6"/>
					</xs:restriction>
				</xs:simpleType>
			</xs:element>
			<xs:element name="Filter" minOccurs="0" maxOccurs="99">
				<xs:simpleType>
					<xs:restriction base="xs:string">
						<xs:maxLength value="10"/>
					</xs:restriction>
				</xs:simpleType>
			</xs:element>
			<xs:element name="XPath">
				<xs:simpleType>
					<xs:restriction base="XPathType"/>
				</xs:simpleType>
			</xs:element>
			<xs:element name="MinOccurence" maxOccurs="99">
				<xs:complexType>
					<xs:simpleContent>
						<xs:extension base="xs:integer">
							<xs:attribute name="use">
								<xs:simpleType>
									<xs:restriction base="xs:string">
										<xs:maxLength value="6"/>
									</xs:restriction>
								</xs:simpleType>
							</xs:attribute>
						</xs:extension>
					</xs:simpleContent>
				</xs:complexType>
			</xs:element>
			<xs:element name="Codelist" minOccurs="0" maxOccurs="unbounded">
				<xs:complexType>
					<xs:simpleContent>
						<xs:extension base="CodeListType">
							<xs:attribute name="use">
								<xs:simpleType>
									<xs:restriction base="xs:string">
										<xs:maxLength value="6"/>
									</xs:restriction>
								</xs:simpleType>
							</xs:attribute>
						</xs:extension>
					</xs:simpleContent>
				</xs:complexType>
			</xs:element>
			<xs:element name="Rule" minOccurs="0" maxOccurs="unbounded">
				<xs:complexType>
					<xs:simpleContent>
						<xs:extension base="ConstraintsType">
							<xs:attribute name="use">
								<xs:simpleType>
									<xs:restriction base="xs:string">
										<xs:maxLength value="6"/>
									</xs:restriction>
								</xs:simpleType>
							</xs:attribute>
						</xs:extension>
					</xs:simpleContent>
				</xs:complexType>
			</xs:element>
			<xs:element name="Condition" minOccurs="0" maxOccurs="unbounded">
				<xs:complexType>
					<xs:simpleContent>
						<xs:extension base="ConstraintsType">
							<xs:attribute name="use">
								<xs:simpleType>
									<xs:restriction base="xs:string">
										<xs:maxLength value="6"/>
									</xs:restriction>
								</xs:simpleType>
							</xs:attribute>
						</xs:extension>
					</xs:simpleContent>
				</xs:complexType>
			</xs:element>
			<xs:element name="Format">
				<xs:simpleType>
					<xs:restriction base="xs:string">
						<xs:maxLength value="10"/>
					</xs:restriction>
				</xs:simpleType>
			</xs:element>
			<xs:element name="DescriptionLine" minOccurs="0" maxOccurs="unbounded">
				<xs:complexType>
					<xs:simpleContent>
						<xs:extension base="DescriptionLineType">
							<xs:attribute name="lang" use="required">
								<xs:simpleType>
									<xs:restriction base="xs:string">
										<xs:maxLength value="2"/>
										<xs:pattern value="fi|sv|en"/>
									</xs:restriction>
								</xs:simpleType>
							</xs:attribute>
							<xs:attribute name="use">
								<xs:simpleType>
									<xs:restriction base="xs:string">
										<xs:maxLength value="6"/>
									</xs:restriction>
								</xs:simpleType>
							</xs:attribute>
						</xs:extension>
					</xs:simpleContent>
				</xs:complexType>
			</xs:element>
			<xs:element name="Hyperlink" minOccurs="0" maxOccurs="99">
				<xs:complexType>
					<xs:sequence>
						<xs:element name="URL">
							<xs:simpleType>
								<xs:restriction base="xs:string">
									<xs:maxLength value="200"/>
								</xs:restriction>
							</xs:simpleType>
						</xs:element>
						<xs:element name="Description">
							<xs:simpleType>
								<xs:restriction base="xs:string">
									<xs:maxLength value="200"/>
								</xs:restriction>
							</xs:simpleType>
						</xs:element>
					</xs:sequence>
					<xs:attribute name="lang" use="required">
						<xs:simpleType>
							<xs:restriction base="xs:string">
								<xs:maxLength value="2"/>
								<xs:pattern value="fi|sv|en"/>
							</xs:restriction>
						</xs:simpleType>
					</xs:attribute>
				</xs:complexType>
			</xs:element>
		</xs:sequence>
	</xs:complexType>
	<xs:simpleType name="XPathType">
		<xs:restriction base="xs:string">
			<xs:maxLength value="50"/>
			<xs:pattern value='[A-Za-z@="]*'/>
			<xs:pattern value=""/>
		</xs:restriction>
	</xs:simpleType>
	<xs:complexType name="MessageType">
		<xs:sequence>
			<xs:element name="Type" minOccurs="0"/>
			<xs:element name="Rule" minOccurs="0" maxOccurs="unbounded">
				<xs:complexType>
					<xs:simpleContent>
						<xs:extension base="ConstraintsType">
							<xs:attribute name="use">
								<xs:simpleType>
									<xs:restriction base="xs:string">
										<xs:maxLength value="6"/>
									</xs:restriction>
								</xs:simpleType>
							</xs:attribute>
						</xs:extension>
					</xs:simpleContent>
				</xs:complexType>
			</xs:element>
			<xs:element ref="DataGroup" maxOccurs="2"/>
		</xs:sequence>
	</xs:complexType>
	<xs:simpleType name="NameType">
		<xs:restriction base="xs:string">
			<xs:maxLength value="100"/>
		</xs:restriction>
	</xs:simpleType>
	<xs:simpleType name="ConstraintsType">
		<xs:restriction base="xs:string">
			<xs:maxLength value="20"/>
		</xs:restriction>
	</xs:simpleType>
	<xs:simpleType name="DescriptionLineType">
		<xs:restriction base="xs:string">
			<xs:maxLength value="2000"/>
		</xs:restriction>
	</xs:simpleType>
	<xs:simpleType name="CodeListType">
		<xs:restriction base="xs:string">
			<xs:maxLength value="15"/>
		</xs:restriction>
	</xs:simpleType>
</xs:schema>