<?xml version="1.0" encoding="UTF-8"?>
<!-- edited with XMLSpy v2018 (x64) (http://www.altova.com) by Finnish Customs (Finnish Customs) -->
<Message xmlns:xsi="http://www.w3.org/2001/XMLSchema-instance" xsi:noNamespaceSchemaLocation="../Message.xsd">
	<Type>FI439A</Type>
	<Name lang="en">Free-formcontact request</Name>
	<DataGroup>
		<Name lang="en">Import operation</Name>
		<XPath>FI439A</XPath>
		<MinOccurence>1</MinOccurence>
		<MaxOccurence>1</MaxOccurence>
		<DataElement>
			<Name lang="fi">MRN</Name>
			<Name lang="sv">MRN</Name>
			<Name lang="en">MRN</Name>
			<XPath>MRN</XPath>
			<MinOccurence>1</MinOccurence>
			<GeneralType>MRN</GeneralType>
			<Format>an18</Format>
		</DataElement>
		<DataElement>
			<Name lang="fi">LRN</Name>
			<Name lang="sv">LRN</Name>
			<Name lang="en">LRN</Name>
			<XPath>FunctionalReference</XPath>
			<MinOccurence>1</MinOccurence>
			<GeneralType>LRN</GeneralType>
			<Format>an..22</Format>
		</DataElement>
		<DataElement>
			<Name lang="en">Additional LRN</Name>
			<XPath>AdditionalFunctionalReference</XPath>
			<MinOccurence>0</MinOccurence>
			<GeneralType>LRN</GeneralType>
			<Format>an..22</Format>
		</DataElement>
		<DataElement>
			<Name lang="en">MessageIdentification</Name>
			<XPath>Identification</XPath>
			<MinOccurence>1</MinOccurence>
			<GeneralType>MessageIdentification</GeneralType>
			<Format>an..14</Format>
		</DataElement>
		<DataElement>
			<Name lang="fi">Kielikoodi</Name>
			<Name lang="sv">Sprì±…kkod</Name>
			<Name lang="en">Language code</Name>
			<XPath>Language</XPath>
			<MinOccurence>1</MinOccurence>
			<GeneralType>LanguageCode</GeneralType>
			<Codelist>CL012</Codelist>
			<Format>a2</Format>
		</DataElement>
		<DataGroup>
			<Name lang="en">Notification</Name>
			<XPath>Notification</XPath>
			<MinOccurence>1</MinOccurence>
			<MaxOccurence>1</MaxOccurence>
			<DataElement>
				<Name lang="en">Notification type</Name>
				<XPath>Type</XPath>
				<MinOccurence>1</MinOccurence>
				<GeneralType>LanguageCode</GeneralType>
				<Format>an..100</Format>
			</DataElement>
			<DataElement>
				<Name lang="en">Notification date and time</Name>
				<XPath>Notification</XPath>
				<MinOccurence>1</MinOccurence>
				<GeneralType>DateTime</GeneralType>
				<Format>dateTime</Format>
			</DataElement>
			<DataElement>
				<Name lang="en">Notification description</Name>
				<XPath>Text</XPath>
				<MinOccurence>0</MinOccurence>
				<GeneralType>Freetext</GeneralType>
				<Format>an..4096</Format>
			</DataElement>
			<DataElement>
				<Name lang="en">Reason for contact</Name>
				<XPath>ContactReason</XPath>
				<MinOccurence>0</MinOccurence>
				<GeneralType>String</GeneralType>
				<Codelist>NCL050</Codelist>
				<Format>an..50</Format>
			</DataElement>
			<DataElement>
				<Name lang="en">Invalidation reason</Name>
				<XPath>Invalidation</XPath>
				<MinOccurence>0</MinOccurence>
				<GeneralType>String</GeneralType>
				<Codelist>NCL062</Codelist>
				<Format>n..50</Format>
			</DataElement>
			<DataElement>
				<Name lang="en">Amendment reason</Name>
				<XPath>Amendment</XPath>
				<MinOccurence>0</MinOccurence>
				<GeneralType>an..50</GeneralType>
				<Codelist>NCL062</Codelist>
				<Format>String</Format>
			</DataElement>
		</DataGroup>
		<DataGroup>
			<Name lang="en">Submitter</Name>
			<XPath>Submitter</XPath>
			<MinOccurence>1</MinOccurence>
			<MaxOccurence>1</MaxOccurence>
			<DataElement>
				<Name lang="en">Submitter name</Name>
				<XPath>Name</XPath>
				<MinOccurence>1</MinOccurence>
				<GeneralType>TraderName</GeneralType>
				<Format>an..70</Format>
			</DataElement>
			<DataGroup>
				<Name lang="en">Submitter e-mail</Name>
				<XPath>Communication</XPath>
				<MinOccurence>1</MinOccurence>
				<MaxOccurence>1</MaxOccurence>
				<DataElement>
					<Name lang="en">Submitter e-mail address</Name>
					<XPath>Identification</XPath>
					<MinOccurence>1</MinOccurence>
					<GeneralType>CommunicationIdentification</GeneralType>
					<Format>an..320</Format>
				</DataElement>
				<DataElement>
					<Name lang="en">Submitter communication type</Name>
					<XPath>Type</XPath>
					<MinOccurence>1</MinOccurence>
					<GeneralType>CommunicationType</GeneralType>
					<Format>a2</Format>
				</DataElement>
			</DataGroup>
			<DataGroup>
				<Name lang="en">Submitter telephone</Name>
				<XPath>Communication</XPath>
				<MinOccurence>0</MinOccurence>
				<MaxOccurence>1</MaxOccurence>
				<DataElement>
					<Name lang="en">Submitter telephone number</Name>
					<XPath>Identification</XPath>
					<MinOccurence>1</MinOccurence>
					<GeneralType>CommunicationIdentification</GeneralType>
					<Format>an..20</Format>
				</DataElement>
				<DataElement>
					<Name lang="en">Submitter communication type</Name>
					<XPath>Type</XPath>
					<MinOccurence>1</MinOccurence>
					<GeneralType>CommunicationType</GeneralType>
					<Format>a2</Format>
				</DataElement>
			</DataGroup>
		</DataGroup>
	</DataGroup>
</Message>
