<?xml version="1.0" encoding="UTF-8"?>
<!-- edited with XMLSpy v2018 (x64) (http://www.altova.com) by Finnish Customs (Finnish Customs) -->
<Message xmlns:xsi="http://www.w3.org/2001/XMLSchema-instance" xsi:noNamespaceSchemaLocation="../../Message.xsd">
	<Type>FI916A</Type>
	<Name lang="en">Rejection notification</Name>
	<DataGroup>
		<Name lang="en">Import operation</Name>
		<XPath>FI916A</XPath>
		<MinOccurence>1</MinOccurence>
		<MaxOccurence>1</MaxOccurence>
		<DataElement>
			<Name lang="fi">MRN</Name>
			<Name lang="sv">MRN</Name>
			<Name lang="en">MRN</Name>
			<XPath>MRN</XPath>
			<MinOccurence>1</MinOccurence>
			<GeneralType>MRN</GeneralType>
			<Format>an18</Format>
		</DataElement>
		<DataElement>
			<Name lang="fi">LRN</Name>
			<Name lang="sv">LRN</Name>
			<Name lang="en">LRN</Name>
			<XPath>FunctionalReference</XPath>
			<MinOccurence>1</MinOccurence>
			<GeneralType>LRN</GeneralType>
			<Format>an..22</Format>
		</DataElement>
		<DataElement>
			<Name lang="fi">Toissijainen LRN</Name>
			<Name lang="sv">Ytterligare LRN</Name>
			<Name lang="en">LRN</Name>
			<XPath>AdditionalFunctionalReference</XPath>
			<MinOccurence>0</MinOccurence>
			<GeneralType>LRN</GeneralType>
			<Format>an..22</Format>
		</DataElement>
		<DataElement>
			<Name lang="fi">Sanoman tunniste</Name>
			<Name lang="sv">Meddelandets identifiering</Name>
			<Name lang="en">Message identification</Name>
			<XPath>Identification</XPath>
			<MinOccurence>1</MinOccurence>
			<GeneralType>MessageIdentification</GeneralType>
			<Format>an..14</Format>
		</DataElement>
		<DataElement>
			<Name lang="fi">Kielikoodi</Name>
			<Name lang="sv">Spr√•kkod</Name>
			<Name lang="en">Language code</Name>
			<XPath>Language</XPath>
			<MinOccurence>1</MinOccurence>
			<GeneralType>LanguageCode</GeneralType>
			<Codelist>CL012</Codelist>
			<Format>a2</Format>
		</DataElement>
		<DataGroup>
			<Name lang="en">Notification</Name>
			<XPath>Notification</XPath>
			<MinOccurence>1</MinOccurence>
			<MaxOccurence>1</MaxOccurence>
			<DataElement>
				<Name lang="en">Notification type</Name>
				<XPath>Type</XPath>
				<MinOccurence>1</MinOccurence>
				<GeneralType>LanguageCode</GeneralType>
				<Format>an..100</Format>
			</DataElement>
			<DataElement>
				<Name lang="en">Notification date and time</Name>
				<XPath>Notification</XPath>
				<MinOccurence>1</MinOccurence>
				<GeneralType>DateTime</GeneralType>
				<Format>dateTime</Format>
			</DataElement>
			<DataElement>
				<Name lang="en">Notification description</Name>
				<XPath>Text</XPath>
				<MinOccurence>0</MinOccurence>
				<GeneralType>Freetext</GeneralType>
				<Format>an..4096</Format>
			</DataElement>
			<DataGroup>
				<Name lang="en">Contact information</Name>
				<XPath>ContactInfo</XPath>
				<MinOccurence>1</MinOccurence>
				<MaxOccurence>1</MaxOccurence>
				<DataElement>
					<Name lang="en">Name</Name>
					<XPath>Name</XPath>
					<MinOccurence>0</MinOccurence>
					<GeneralType>TraderName</GeneralType>
					<Format>an..100</Format>
				</DataElement>
				<DataElement>
					<Name lang="en">E-mail</Name>
					<XPath>Email</XPath>
					<MinOccurence>0</MinOccurence>
					<GeneralType>String</GeneralType>
					<Format>an..320</Format>
				</DataElement>
				<DataElement>
					<Name lang="en">Telephone</Name>
					<XPath>Name</XPath>
					<MinOccurence>0</MinOccurence>
					<GeneralType>TelephoneNumber</GeneralType>
					<Format>an..20</Format>
				</DataElement>
			</DataGroup>
			<DataGroup>
				<Name lang="en">Error</Name>
				<XPath>Error</XPath>
				<MinOccurence>1</MinOccurence>
				<MaxOccurence>999</MaxOccurence>
				<DataElement>
					<Name lang="en">Error code</Name>
					<XPath>Code</XPath>
					<MinOccurence>1</MinOccurence>
					<GeneralType>String</GeneralType>
					<Format>an..10</Format>
				</DataElement>
				<DataElement>
					<Name lang="en">Error reason</Name>
					<XPath>Reason</XPath>
					<MinOccurence>0</MinOccurence>
					<GeneralType>String</GeneralType>
					<Format>an..4096</Format>
				</DataElement>
				<DataElement>
					<Name lang="en">Error pointer</Name>
					<XPath>Pointer/Location</XPath>
					<MinOccurence>1</MinOccurence>
					<GeneralType>String</GeneralType>
					<Format>an..200</Format>
				</DataElement>
				<DataElement>
					<Name lang="en">Original attribute value</Name>
					<XPath>OriginaValue</XPath>
					<MinOccurence>1</MinOccurence>
					<GeneralType>String</GeneralType>
					<Format>an..512</Format>
				</DataElement>
			</DataGroup>
		</DataGroup>
	</DataGroup>
</Message>
