<?xml version="1.0" encoding="UTF-8"?>
<!-- edited with XMLSpy v2018 (x64) (http://www.altova.com) by Finnish Customs (Finnish Customs) -->
<Message xmlns:xsi="http://www.w3.org/2001/XMLSchema-instance" xsi:noNamespaceSchemaLocation="../../Message.xsd">
	<Type>FI428A</Type>
	<Name lang="fi">Hyväksymissanoma</Name>
	<Name lang="sv">Meddelande om godtagande</Name>
	<Name lang="en">Acceptance notification</Name>
	<DataGroup>
		<Name lang="fi">Tuontitapahtuma</Name>
		<Name lang="sv">Importåtgärd</Name>
		<Name lang="en">Import operation</Name>
		<XPath>FI428A</XPath>
		<MinOccurence>1</MinOccurence>
		<MaxOccurence>1</MaxOccurence>
		<DataElement>
			<Name lang="fi">MRN</Name>
			<Name lang="sv">MRN</Name>
			<Name lang="en">MRN</Name>
			<XPath>FunctionalReference@function="MRN"</XPath>
			<MinOccurence>1</MinOccurence>
			<GeneralType>MRN</GeneralType>
			<Format>an18</Format>
		</DataElement>
		<DataElement>
			<Name lang="fi">Tapahtuman tunniste</Name>
			<Name lang="sv">Händelsens identifiering</Name>
			<Name lang="en">Case identification</Name>
			<XPath>Identification</XPath>
			<MinOccurence>1</MinOccurence>
			<GeneralType>CaseIdentification</GeneralType>
			<Format>an..22</Format>
		</DataElement>
		<DataElement>
			<Name lang="fi">LRN</Name>
			<Name lang="sv">LRN</Name>
			<Name lang="en">LRN</Name>
			<XPath>FunctionalReference@function="LRN"</XPath>
			<MinOccurence>1</MinOccurence>
			<GeneralType>LRN</GeneralType>
			<Format>an..22</Format>
		</DataElement>
		<DataElement>
			<Name lang="fi">Toissijainen LRN</Name>
			<Name lang="sv">Sekundär LRN</Name>
			<Name lang="en">Additional LRN</Name>
			<XPath>FunctionalReference@function="AdditionalLRN"</XPath>
			<MinOccurence>0</MinOccurence>
			<GeneralType>LRN</GeneralType>
			<Format>an..22</Format>
		</DataElement>
		<DataElement>
			<Name lang="fi">Kielikoodi</Name>
			<Name lang="sv">Språkkod</Name>
			<Name lang="en">Language code</Name>
			<XPath>Language</XPath>
			<MinOccurence>1</MinOccurence>
			<GeneralType>LanguageCode</GeneralType>
			<Codelist>CL012</Codelist>
			<Format>a2</Format>
		</DataElement>
		<DataGroup>
			<Name lang="fi">Ilmoitus</Name>
			<Name lang="sv">Underrättelse</Name>
			<Name lang="en">Notification</Name>
			<XPath>Notification</XPath>
			<MinOccurence>1</MinOccurence>
			<MaxOccurence>1</MaxOccurence>
			<DataElement>
				<Name lang="fi">Ilmoituksen tyyppi</Name>
				<Name lang="sv">Underrättelsens typ</Name>
				<Name lang="en">Notification type</Name>
				<XPath>Type</XPath>
				<MinOccurence>1</MinOccurence>
				<GeneralType>LanguageCode</GeneralType>
				<Format>an..100</Format>
			</DataElement>
			<DataElement>
				<Name lang="fi">Ilmoituksen päiväys ja aika</Name>
				<Name lang="sv">Underrättelsens datum och tid</Name>
				<Name lang="en">Notification date and time</Name>
				<XPath>Notification</XPath>
				<MinOccurence>1</MinOccurence>
				<GeneralType>DateTime</GeneralType>
				<Format>dateTime</Format>
			</DataElement>
		</DataGroup>

	</DataGroup>
</Message>
